queryNum,subQueryNum,query,text1,document1,score1,text2,document2,score2,text3,document3,score3,text4,document4,score4,text5,document5,score5
69_1,1," <span>How do you sleep after jet lag?</span>"," Melatonin is a hormone made by the pineal gland, a small gland in the brain. Melatonin helps control your sleep and wake cycles. Very small amounts of it are found in foods such as meats, grains, fruits, and vegetables.You can also buy it as a supplement.elatonin supplements are sometimes used to treat jet lag or sleep problems (insomnia). Scientists are also looking at other good uses for melatonin, such as: 1  Treating seasonal affective disorder (SAD).",MARCO_4899775,4," 1 hormone-like secretion (in hormone: Endocrine-like glands and secretions) 2  jet lag (in jet lag) 3  pineal gland (in pineal gland) (in pineal gland: Pineal hormones) 4  MedlinePlus - Melatonin.  University of Maryland Medical Center - Melatonin.",MARCO_518423,0," Things that may affect melatonin production and can cause sleep problems include: 1  Jet lag. Crossing time zones disrupts your body clock. 2  Changing your sleep schedule. When you work at night and sleep during the day, your body's internal clock needs to reset to let you sleep during the day. 3  Your sleep environment.",MARCO_619334,0," Circadian disruptions such as jet lag put us in conflict with our natural sleep patterns, since the shift in time and light cues on the brain forces the body to alter its normal pattern to adjust. This is why jet lag can leave travelers feeling poorly and having more difficulty thinking and performing well.",MARCO_6574019,0," A different brain chemical, though, melatonin, can get from our gut to our brain. Melatonin is a hormone secreted at night by the pineal gland in the center of our brain to help regulate our circadian rhythm.Supplements of the stuff are used to prevent and reduce jet lag, and about 20 years ago MIT got the patent to use melatonin to help people sleep. different brain chemical, though, melatonin, can get from our gut to our brain. Melatonin is a hormone secreted at night by the pineal gland in the center of our brain to help regulate our circadian rhythm.",MARCO_6918708,4
69_1,1," <span>How do you sleep after jet lag?</span>"," Learn when to take melatonin. Melatonin can been used for circadian rhythm sleep disorders such as delayed sleep-wake phase disorder, which results in the inability to fall asleep before 2:00 am or later. It can also be used to help with sleep problems related to working night shifts, general insomnia, and jet lag.",MARCO_7262068,4," I decided to take some Nytol to help me with a period of bad jet lag. I opted for the Nytol original over the herbal which I understand to be half the strength of Nytol One a Night. After using it three alternate nights (so over six days) they do allow me several hours sleep.o although the Nytol seemed to give me a good nights sleep, it didnt quite leave me feeling 100% the next morning. I was still able to go about my day and work productively, but those symptoms were annoying. So the second night I tried exactly the same routine.",MARCO_770775,4," Not Just for Kids. The brains at Olly must have heard my pleas for grown-up gummy vitamins that improve hair, skin, and nails, because this spring the brand debuted just that. The Undeniable Beauty supplement includes my personal hair growth favorite, biotin, and has an amazing grapefruit flavor. Lately, Ive also added the brands Restful Sleep gummy to my in-flight routine to prevent jet lag. Getting my beauty sleep has never been tastier.",MARCO_8612925,4," Jet lag symptoms may include: 1  Disturbed sleep  such as insomnia, early waking or excessive sleepiness. 2  Daytime fatigue. 3  Difficulty concentrating or functioning at your usual level.  Stomach problems, constipation or 1  diarrhea. A general feeling of not being well.  Mood changes.",MARCO_886210,0," 1 Jet lag. 2  Most research shows that melatonin can improve certain symptoms of jet lag such as alertness and movement coordination. 3  Melatonin also seems to slightly improve other jet lag symptoms such as daytime sleepiness and tiredness.",MARCO_2131253,0
69_2,2," How do you sleep after jet lag?<br/><span>Does melatonin help?</span>"," Jet lag - jet lag and late night schedules disrupt circadian cycle of melatonin. Non-addictive  safely resets circadian rhythms and natural sleep patterns, improving overall sleep quality. No Hangover  unlike other types of sleep aids, melatonin does not produce a hang-over feeling in the morning.",MARCO_1018952,4," Melatonin helps you develop healthy sleeping patterns. Overview. Melatonin helps you develop healthy sleeping patterns. According to MayoClinic.com, melatonin is a hormone that is naturally produced in the brain. Melatonin is released and stimulated in the brain by darkness, and is suppressed by both natural and artificial light. Although melatonin is naturally produced, melatonin supplements are prescribed and used for a variety of reasons.",MARCO_1085320,0," A: Melatonin is a hormone that helps to regulate the sleep-wake cycle. Levels of the hormone drop during the day and rise at night. Studies suggest that melatonin helps restore sleep when the body's internal clock is disrupted like when people work at night and sleep during the day or as a result of jet lag.",MARCO_1502872,4," Vivid dream is also associated with melatonin use. Melatonin side-effects are usually temporary and can be relieved by reducing the melatonin dosage. About 8% of people taking 5 mg of melatonin or less per day will feel sleepy during the day. For a complete list of melatonin side effects pls.visit this link: http:www.melatoninfaq.commelatonin-side-effects .ivid dream is also associated with melatonin use. Melatonin side-effects are usually temporary and can be relieved by reducing the melatonin dosage. About 8% of people taking 5 mg of melatonin or less per day will feel sleepy during the day. For a complete list of melatonin side effects pls.",MARCO_1792056,0," Pineal Gland Essentials. 1  Of the endocrine organs, the function of the pineal gland was the last discovered. 2  Located deep in the center of the brain, the pineal gland was once known as the third eye.. 3  The pineal gland produces melatonin, which helps maintain circadian rhythm and regulate reproductive hormones. Located deep in the center of the brain, the pineal gland was once known as the third eye.. 2  The pineal gland produces melatonin, which helps maintain circadian rhythm and regulate reproductive hormones.",MARCO_2107886,0
69_2,2," How do you sleep after jet lag?<br/><span>Does melatonin help?</span>"," Melatonin supplements are sometimes used to treat jet lag or sleep problems (insomnia). Scientists are also looking at other good uses for melatonin, such as: 1  Treating seasonal affective disorder (SAD). 2  Helping to control sleep patterns for people who work night shifts.",MARCO_2305440,4," When you travel, you can take melatonin to help with jet lag, which is daytime fatigue that occurs when changing time zones. The first night you arrive at your destination, you can take 0.5 to 5 mg of melatonin. Taking it can help you sleep and reset your sleeping patterns to match the new time zone you traveled to.",MARCO_2668210,4," Melatonin receptor agonist. Melatonin receptor agonists are analogues of melatonin that bind to and activate the melatonin receptor. Agonists of the melatonin receptor have a number of therapeutic applications including treatment of sleep disorders and depression. The discovery and development of melatonin receptor agonists was motivated by the need for more potent analogues than melatonin, with better pharmacokinetics and longer half-life.",MARCO_3065842,0," What does it do? Melatonin appears to be important in helping regulatethe internal body clocks cycle of sleep and wakefulness.Other claims are made for it: it has anti-oxidant and freeradical scavenging properties and some say it has anti-cancer and anti-ageing effects, but there is no proof forthis in humans.",MARCO_3132328,0," Its important to understand that melatonin can help induce sleep, but it will not maintain sleep, says Dr. Kothare. Melatonin supplements can also be a great way to break the cycle of insomnia, deal with jet lag, or adjust to life as a shift worker, says Dr. Kothare.",MARCO_3793515,4
69_2,2," How do you sleep after jet lag?<br/><span>Does melatonin help?</span>"," Although it's common to have the occasional sleepless night, insomnia is the inability to sleep or excessive wakening in the night that impairs daily functioning. Of natural remedies, three have been shown to be useful, and others have some preliminary but inconclusive evidence. Since chronic lack of sleep may be linked to a number of health problems (such as diabetes, high blood pressure, and depression), it's important to consult your physician and avoid self-treating with alternative medicine. 1  Here are 14 natural remedies to consider: Melatonin. Melatonin supplements are widely recommended for various sleep conditions, but the best evidence is for help with sleep problems caused by shift work or jet lag. Melatonin is a naturally-occurring hormone that regulates the sleep-wake cycle in the brain.",MARCO_40714,4," What is melatonin? Melatonin is produced by various tissues in the body, although the major source is the pineal gland in the brain. The production and release of melatonin from the pineal gland occurs with a clear daily (circadian) rhythm, with peak levels occurring at night. Melatonin is carried by the circulation from the brain to all areas of the body.",MARCO_4451278,0," Melatonin might also be helpful for insomnia for some people. There is also some evidence that melatonin might improve the effectiveness of cancer drugs used to fight tumors in the breast, lung, kidney, liver, pancreas, stomach and colon.",MARCO_4818050,0," Also, melatonin supplements can be effective in treating certain sleep disorders, including jet lag, says Avidan. But studies suggest you must time the melatonin you take carefully to help with jet lag. On the day you depart, take melatonin when it is bedtime at your destination. Continue taking it for several days.",MARCO_4948744,4," Melatonin is a hormone made by a part of the brain called the pineal (say: pie-nee-all) gland. Melatonin may help our bodies know when it's time to go to sleep and when it's time to wake up.Melatonin supplements (in pill form) are also available.Two types of melatonin may be used in these pills: natural and synthetic (manmade). Natural melatonin is made from the pineal gland of animals. This form could be contaminated with a virus so it is not recommended.elatonin supplements (in pill form) are also available. Two types of melatonin may be used in these pills: natural and synthetic (manmade). Natural melatonin is made from the pineal gland of animals. This form could be contaminated with a virus so it is not recommended.",MARCO_5328576,0
69_2,2," How do you sleep after jet lag?<br/><span>Does melatonin help?</span>"," Studies suggest that melatonin helps restore sleep when the body's internal clock is disrupted like when people work at night and sleep during the day or as a result of jet lag. Melatonin as a supplement can cause fatigue, dizziness, headache, irritability, and sleepiness.",MARCO_5606712,4," Melatonin supplements in pill form are usually a man-made synthetic melatonin, which is chemically identical to melatonin produced in your body. However, natural melatonin is made from the brain tissue of cows.elatonin is a hormone produced by the pineal gland, a pea-sized gland that sits just below the center of your brain. Many people incorrectly search on the Internet for melatonin herb or melatonin vitamin, not knowing that melatonin is a hormone rather than a nutrient.",MARCO_5932550,0," Birth control increases melatonin levels in the body, so taking melatonin supplements may cause high melatonin levels. Taking melatonin supplements alongside sedatives such as benzodiazepines may cause excessive sleepiness.",MARCO_6100383,0," During health exams, tell your doctor if you are taking melatonin. And tell your doctor if you are having trouble sleeping (insomnia), because it may be related to a medical problem. In adults, melatonin is taken in doses from 0.2 mg to 20.0 mg, based on the reason for its use.n most cases, melatonin supplements are safe in low doses for short-term and long-term use. But be sure to talk with your doctor about taking them. Children and pregnant or nursing women should not take melatonin without talking to a doctor first. Melatonin does have side effects.",MARCO_6261153,0," 1 Jet lag: 0.5 to 5 mg of melatonin 1 hour prior to bedtime at final destination has been used in several studies. 2  Another approach that has been used is 1 to 5 mg 1 hour before bedtime for 2 days prior to departure and for 2 to 3 days upon arrival at final destination. Insomnia: 1 to 3 mg 1 hour before bedtime is usually effective, although doses as low as 0.1 to 0.3 mg may improve sleep for some people. 2  If 3 mg per night does not work after 3 days, try 5 to 6 mg 1 hour before bedtime.",MARCO_6461161,4
69_2,2," How do you sleep after jet lag?<br/><span>Does melatonin help?</span>"," A: Melatonin is a hormone that helps to regulate the sleep-wake cycle. Levels of the hormone drop during the day and rise at night. Studies suggest that melatonin helps restore sleep when the body's internal clock is disrupted like when people work at night and sleep during the day or as a result of jet lag.elatonin overdose can lead to severe drowsiness and affect your sleep-wake cycle. Symptoms of a melatonin overdose may include headache, drowsiness, and upset stomach. If you suspect an overdose, you should contact a poison-control center or emergency room immediately.",MARCO_6630183,4," Use the lowest dose when you first start taking this supplement. Take melatonin at bedtime or when you are ready to sleep. If you're using the supplement to treat jet lag, take the dose at bedtime on the day you arrive at your destination and keep using it for two to five days.elatonin overdose can lead to severe drowsiness and affect your sleep-wake cycle. Symptoms of a melatonin overdose may include headache, drowsiness, and upset stomach. If you suspect an overdose, you should contact a poison-control center or emergency room immediately.",MARCO_6867524,4," A different brain chemical, though, melatonin, can get from our gut to our brain. Melatonin is a hormone secreted at night by the pineal gland in the center of our brain to help regulate our circadian rhythm.Supplements of the stuff are used to prevent and reduce jet lag, and about 20 years ago MIT got the patent to use melatonin to help people sleep. different brain chemical, though, melatonin, can get from our gut to our brain. Melatonin is a hormone secreted at night by the pineal gland in the center of our brain to help regulate our circadian rhythm.",MARCO_6918708,0," Taking fluvoxamine (Luvox) can increase the amount of melatonin that the body absorbs. Taking melatonin along with fluvoxamine (Luvox) might increase the effects and side effects of melatonin. Medications for diabetes (Antidiabetes drugs) interacts with MELATONIN. Melatonin might increase blood sugar. Diabetes medications are used to lower blood sugar.",MARCO_7226464,0," Learn when to take melatonin. Melatonin can been used for circadian rhythm sleep disorders such as delayed sleep-wake phase disorder, which results in the inability to fall asleep before 2:00 am or later. It can also be used to help with sleep problems related to working night shifts, general insomnia, and jet lag.",MARCO_7262068,4
69_2,2," How do you sleep after jet lag?<br/><span>Does melatonin help?</span>"," Walnuts are a good source of tryptophan, a sleep-enhancing amino acid that helps make serotonin and melatonin, the a body clocka clock hormone that sets-your sleep. Wake, Cycles additionally University of texas researchers found that walnuts contain their own source, of melatonin which may help you fall. asleep fasteralnuts are a good source of tryptophan, a sleep-enhancing amino acid that helps make serotonin and melatonin, the a body clocka clock hormone that sets-your sleep. Wake, Cycles additionally University of texas researchers found that walnuts contain their own source, of melatonin which may help you fall. asleep faster",MARCO_7694211,0," How to Help Your Body Produce Melatonin More Efficiently. This important hormone is also regulated by the sun, which is one reason daylight savings time can interfere with a good nights rest. It can help to get 15 minutes of morning sunlight each day to start helping your melatonin levels work more properly. You can also eat certain foods that help get your levels back where they should be too. These foods contain certain nutrients that assist with serotonin production, which is necessary for proper melatonin production in the body. Remember, your hormones are always working together to help you, so long as you give them what they need to do their job effectively.",MARCO_883211,0," Melatonin in pill form does not function like your bodys naturally produced melatonin: It affects the brain in bursts and rapidly leaves the system, instead of the slow build-up and slow wash-out that your bodys naturally produced melatonin experiences. The correct dosage of melatonin can be a problem.",MARCO_97925,0," Melatonin helps you develop healthy sleeping patterns. Overview. Melatonin helps you develop healthy sleeping patterns. According to MayoClinic.com, melatonin is a hormone that is naturally produced in the brain. Melatonin is released and stimulated in the brain by darkness, and is suppressed by both natural and artificial light. Although melatonin is naturally produced, melatonin supplements are prescribed and used for a variety of reasons.",MARCO_1085320,0," Jet lag - jet lag and late night schedules disrupt circadian cycle of melatonin. Non-addictive  safely resets circadian rhythms and natural sleep patterns, improving overall sleep quality. No Hangover  unlike other types of sleep aids, melatonin does not produce a hang-over feeling in the morning.",MARCO_1018952,4
69_3,3," How do you sleep after jet lag?<br/>Does melatonin help?<br/><span>How was it discovered?</span>"," Melatonin helps you develop healthy sleeping patterns. Overview. Melatonin helps you develop healthy sleeping patterns. According to MayoClinic.com, melatonin is a hormone that is naturally produced in the brain. Melatonin is released and stimulated in the brain by darkness, and is suppressed by both natural and artificial light. Although melatonin is naturally produced, melatonin supplements are prescribed and used for a variety of reasons.",MARCO_1085320,0," A: Melatonin is a hormone that helps to regulate the sleep-wake cycle. Levels of the hormone drop during the day and rise at night. Studies suggest that melatonin helps restore sleep when the body's internal clock is disrupted like when people work at night and sleep during the day or as a result of jet lag.",MARCO_1502872,0," How to Reduce Lag in Minecraft. Minecraft, what a wounderful game; well when you can play smoothly and without lag! I have recently discovered a mod that helps you reduce lag. Unfortunately it isnt updated to Minecraft 1.8.1.",MARCO_1788749,0," Scientists have discovered dopamine's role in regulating sleep, which could impact studies on jet lag and mood disorders. A feel-good brain chemical called dopamine has been linked to everything from laziness and creativity to impulsivity and a tendency to partake in one-night stands.",MARCO_1885176,0," Unlike what happens in real jet lag, people who suffer from social jet lag never leave their home base and can therefore never adjust to a new light-dark environment  While real jet lag is acute and transient, social jet lag is chronic.",MARCO_2082129,0
69_3,3," How do you sleep after jet lag?<br/>Does melatonin help?<br/><span>How was it discovered?</span>"," Beyond the Planets - the discovery of Pluto. Key points: How Pluto was discovered. Mercury, Venus, Earth, Mars, Jupiter, and Saturn have all been known since ancient times. Uranus was discovered by chance by Herschel in 1781. Neptune was discovered in 1846, ostensibly as a result of calculations to explain deviations in the position of Uranus, but substantial luck was involved.",MARCO_2224506,0," When was the element krypton discovered? Krypton was discovered in 1898 by Sir William Ramsay and his student Morris Travers in Great Britain. (Source: Webelements)",MARCO_2376861,0," Answer: The seventh planet from the sun was discovered by William Herschel in 1781.nswer: The seventh planet from the sun was discovered by William Herschel in 1781.",MARCO_2571438,0," Lithium was discovered by Johan August Arfvedson in 1817. Sodium was discovered by Sir Humphrey Davy in 1807.ithium was discovered by Johan August Arfvedson in 1817. Sodium was discovered by Sir Humphrey Davy in 1807.",MARCO_2704184,0," Melatonin, the hormone secreted by the pineal gland, was not discovered until the late 1950s. Its role in regulating biological rhythms was then uncovered only gradually, making the pineal gland the last of the endocrine glands to have its function identified.",MARCO_2921511,0
69_3,3," How do you sleep after jet lag?<br/>Does melatonin help?<br/><span>How was it discovered?</span>"," Figure 1-2 Oracle BI Discoverer Plus. Discoverer Viewer is a Web tool for accessing interactive reports and charts created using Discoverer Plus. Because Discoverer Viewer is a thin client HTML tool, users require only a Web browser to run Discoverer Viewer.",MARCO_3078392,0," Melatonin secreted by the pineal gland is an important part of the bodys circadian timing system and can synchronise daily rhythms (see the articles on jet lag and circadian rhythm sleep disorders).",MARCO_3117597,0," Discover the signs of blocked energy in the crown chakra and how you may benefit from aligning it. 1  Chakras #ChakraTuneUp2015: Intro to the Anahata Discover the physical and mental signs of blocked energy in the fourth chakra and how you may benefit from aligning it.",MARCO_3267812,0," As there are only about a hundred natural elements in the universe, discovering two is quite a big thing! She called them polonium, after her home country of Poland, and radium because it was radioactive. Radioactivity is a very good word and it was invented by Marie Curie.Elements that were radioactive gave out strange, unknown rays that seemed to be very similar to the recently discovered X-rays.This is how she knew where to look for radium and polonium.s there are only about a hundred natural elements in the universe, discovering two is quite a big thing! She called them polonium, after her home country of Poland, and radium because it was radioactive. Radioactivity is a very good word and it was invented by Marie Curie.",MARCO_3843327,0," Gold was first discovered as shining, yellow nuggets. Gold is where you find it, so the saying goes, and gold was first discovered in its natural state, in streams all over the world. No doubt it was the first metal known to early hominids.",MARCO_4124470,0
69_3,3," How do you sleep after jet lag?<br/>Does melatonin help?<br/><span>How was it discovered?</span>"," Define discovered. discovered synonyms, discovered pronunciation, discovered translation, English dictionary definition of discovered. tr.v. discovered , discovering , discovers 1. To notice or learn, especially by making an effort: got home and discovered that the furnace wasn't...",MARCO_4415854,0," Melatonin is a hormone produced in the brain by the pineal gland from the amino acid tryptophan. The production and release of melatonin are stimulated by darkness and decreased by light, suggesting that melatonin is involved in circadian rhythm (the internal body clock) and regulation of diverse body functions.Levels of melatonin in the blood are highest prior to bedtime.he production and release of melatonin are stimulated by darkness and decreased by light, suggesting that melatonin is involved in circadian rhythm (the internal body clock) and regulation of diverse body functions. Levels of melatonin in the blood are highest prior to bedtime.",MARCO_4899776,0," The foremost symptom of jet lag is altered sleep patternsleepiness during the day, and insomnia during the night. Jet lag may also include indigestion and trouble concentrating. Individuals afflicted by jet lag will alternate in and out of a normal day-night cycle.",MARCO_4957399,0," HistoryLore. With the trees name, you might assume it was discovered by a man named Bartlett. But story is not nearly so simple. The variety was actually discovered growing wild in England by John Stair sometime around 1770.",MARCO_5250608,0," Melatonin is meant to reset the body's internal clock -- for example, it's appropriate to use the supplement to counter the effects of jet lag, or help someone sleep if they have an unusual work schedule or suffer from a circadian rhythm disorder. It should not be used for general insomnia. The proper dosage, according to a seminal 2001 study from the Massachusetts Institute of Technology, is 0.3 milligrams. The research was conducted by Richard Wurtman, who pioneered the pharmaceutical use of melatonin as a sleep aid in 1994.",MARCO_5430134,2
