queryNum,subQueryNum,query,text1,document1,score1,text2,document2,score2,text3,document3,score3,text4,document4,score4,text5,document5,score5
67_5,5," Why is blood red?<br/>What are red blood cells?<br/>How are they created?<br/>How is oxygen transported?<br/><span>What is anemia?</span>"," Blood Disorders Affecting Red Blood Cells. Blood disorders that affect red blood cells include: Anemia: People with anemia have a low number of red blood cells. Mild anemia often causes no symptoms. More severe anemia can cause fatigue, pale skin, and shortness of breath with exertion. Iron-deficiency anemia: Iron is necessary for the body to make red blood cells.",MARCO_8802355,3," Anemia is a condition in which the body does not have enough healthy red blood cells. Red blood cells provide oxygen to body tissues. There are many types of anemia. Iron deficiency anemia occurs when your body does not have enough iron. Iron helps make red blood cells. Iron deficiency anemia is the most common form of anemia. Red blood cells bring oxygen to the body's tissues. Healthy red blood cells are made in your bone marrow.",MARCO_999734,3," Anemia is a disease where your red blood cell count is lower than normal or it does not have enough haemoglobin (a protein that carries oxygen). It has many causes, but the bottom line is that the cells in all parts of the body are delivered with a small amount of oxygen and nutrients.nemia is a disease where your red blood cell count is lower than normal or it does not have enough haemoglobin (a protein that carries oxygen). It has many causes, but the bottom line is that the cells in all parts of the body are delivered with a small amount of oxygen and nutrients.",MARCO_1796654,0," There are several types of anemia such as iron deficiency anemia (the most common type), sickle cell anemia, vitamin B12 anemia, pernicious anemia, and aplastic anemia. Symptoms of anemia may include. fatigue, malaise, hair loss, palpitations, menstruation, and.",MARCO_1550291,1," the anemia in which the red blood cells are normal in size. nutritional anemia. anemia due to a deficiency of an essential substance in the diet, which may be caused by poor dietary intake or by malabsorption; called also deficiency anemia. See also pyridoxine, vitamin b12, folic acid, copper, iron.",MARCO_1254004,2
67_6,6," Why is blood red?<br/>What are red blood cells?<br/>How are they created?<br/>How is oxygen transported?<br/>What is anemia?<br/><span>What are the symptoms?</span>"," Blood disorders that affect red blood cells include: Anemia: People with anemia have a low number of red blood cells. Mild anemia often causes no symptoms. More severe anemia can cause fatigue, pale skin, and shortness of breath with exertion. Iron-deficiency anemia: Iron is necessary for the body to make red blood cells. Low iron intake and loss of blood due to menstruation are the most common causes of iron-deficiency anemia. It may also be caused by blood loss from the GI tract because of ulcers or cancer.",MARCO_1179775,2," The list of signs and symptoms mentioned in various sources for Hepatitis includes the 35 symptoms listed below: 1  No symptoms - in some cases. 2  Mild symptoms - in some cases. 3  Early symptoms: Mild fever. Mild flu-like symptoms.  Later symptoms: Dark urine. Red 1  urine. Severe symptoms of fulminant hepatitis Edema. Loss of consciousness.",MARCO_1250020,0," Anemia (uh-NEE-me-uh) is a condition in which your blood has a lower than normal number of red blood cells. Anemia also can occur if your red blood cells don't contain enough hemoglobin (HEE-muh-glow-bin).Hemoglobin is an iron-rich protein that gives blood its red color.This protein helps red blood cells carry oxygen from the lungs to the rest of the body. If you have anemia, your body doesn't get enough oxygen-rich blood.As a result, you may feel tired or weak. You also may have other symptoms, such as shortness of breath, dizziness, or headaches. Severe or long-lasting anemia can damage your heart, brain, and other organs in your body.f you have anemia, your body doesn't get enough oxygen-rich blood. As a result, you may feel tired or weak. You also may have other symptoms, such as shortness of breath, dizziness, or headaches. Severe or long-lasting anemia can damage your heart, brain, and other organs in your body.",MARCO_1331426,4," Walking symptoms. Toe walking (symptom description): Toe walking is listed as a type of or related-symptom for symptom Walking symptoms. Toe walking (symptom description): For a medical symptom description of 'Toe walking', the following symptom information may be relevant to the symptoms: Walking symptoms (type of symptom). However, note that other causes of the symptom 'Toe walking' may be possible.",MARCO_1415631,0," What are the symptoms of tetanus? A common first sign of tetanus is muscular stiffness in the jaw (lockjaw). Other symptoms include stiffness of the neck, trouble swallowing, painful muscle stiffness all over the body, spasms, sweating, and fever.",MARCO_1511367,0
67_6,6," Why is blood red?<br/>What are red blood cells?<br/>How are they created?<br/>How is oxygen transported?<br/>What is anemia?<br/><span>What are the symptoms?</span>"," Symptom Checker. 1  Throat symptoms and Head symptoms (3112 causes) 2  Throat symptoms and Mouth symptoms (3058 causes) 3  Throat symptoms and Nerve symptoms (2569 causes)  Throat symptoms and Respiratory symptoms (2552 1  causes) Throat symptoms and Face symptoms (2518 causes)  Throat symptoms and Sensory symptoms (2182 causes)",MARCO_1623817,0," About 70 percent of the body's iron is found in the red blood cells of blood called hemoglobin and in muscle cells called myoglobin. Anemia-A term that means less than normal levels of red blood cells or hemoglobin in the blood. The term is derived from the Greek term anaimia, meaning lack of blood.Symptoms of anemia often include: 1  Fainting. 2  Pale skin. 3  Weakness. 4  Chest pain. 5  Palpitations. 6  Shortness of breath. 7  Restless legs syndrome.nemia-A term that means less than normal levels of red blood cells or hemoglobin in the blood. The term is derived from the Greek term anaimia, meaning lack of blood. Symptoms of anemia often include: 1  Fainting. 2  Pale skin. 3  Weakness. 4  Chest pain. 5  Palpitations. 6  Shortness of breath.",MARCO_1642338,3," Choose another medical symptom from the list below to search in addition to the already chosen symptoms to narrow the list of potential disease causes shown: 1  AND Head symptoms (60 matches). 2  AND Mouth symptoms (59 matches). 3  AND Nerve symptoms (59 matches). 4  AND Sensory symptoms (58 matches). 5  AND Taste symptoms (58 matches).",MARCO_1766545,0," Stiffness. Stiff hand (symptom description): Stiff hand is listed as a type of or related-symptom for symptom Stiffness. Stiff hand (symptom description): For a medical symptom description of 'Stiff hand', the following symptom information may be relevant to the symptoms: Stiffness (type of symptom).However, note that other causes of the symptom 'Stiff hand' may be possible.tiff hand (symptom description): For a medical symptom description of 'Stiff hand', the following symptom information may be relevant to the symptoms: Stiffness (type of symptom).",MARCO_1811821,0," The most common symptom of all types of anemia is fatigue (tiredness). Fatigue occurs because your body doesn't have enough red blood cells to carry oxygen to its many parts. Also, the red blood cells your body makes have less hemoglobin than normal.Hemoglobin is an iron-rich protein in red blood cells.It helps red blood cells carry oxygen from the lungs to the rest of the body. Anemia also can cause shortness of breath, dizziness, headache, coldness in your hands and feet, pale skin, chest pain, weakness, and fatigue (tiredness).If you don't have enough hemoglobin-carrying red blood cells, your heart has to work harder to move oxygen-rich blood through your body.he most common symptom of all types of anemia is fatigue (tiredness). Fatigue occurs because your body doesn't have enough red blood cells to carry oxygen to its many parts. Also, the red blood cells your body makes have less hemoglobin than normal.",MARCO_2074177,4
67_6,6," Why is blood red?<br/>What are red blood cells?<br/>How are they created?<br/>How is oxygen transported?<br/>What is anemia?<br/><span>What are the symptoms?</span>"," Anemia is a condition that develops when your blood lacks enough healthy red blood cells or hemoglobin. Hemoglobin is a main part of red blood cells and binds oxygen. If you have too few or abnormal red blood cells, or your hemoglobin is abnormal or low, the cells in your body will not get enough oxygen.Symptoms of anemia -- like fatigue -- occur because organs aren't getting what they need to function properly.nherited disorders can affect your bodys production of red blood cells. Thalassemias cause the body to make fewer healthy red blood cells and less hemoglobin -- and may be treated with blood transfusions. Among people with hemolytic anemia, red blood cells are destroyed and cleaned out of the bloodstream too quickly.",MARCO_2222751,0," Anemia develops when the body does not produce enough red blood cells or red cells are lost due to bleeding or other causes. In people with anemia, the blood is unable to supply enough oxygen to the body. There are many possible causes of anemia.Symptoms of anemia can include: 1  Fatigue. 2  Weakness. 3  Dizziness.hysicians in the Benign Hematology Program specialize in evaluating patients with abnormal blood counts to identify the cause of their condition and create a personalized treatment plan.",MARCO_2424419,1," Anemia (uh-NEE-me-uh) is a condition in which your blood has a lower than normal number of red blood cells. Anemia also can occur if your red blood cells don't contain enough hemoglobin (HEE-muh-glow-bin).Hemoglobin is an iron-rich protein that gives blood its red color.This protein helps red blood cells carry oxygen from the lungs to the rest of the body. If you have anemia, your body doesn't get enough oxygen-rich blood.As a result, you may feel tired or weak. You also may have other symptoms, such as shortness of breath, dizziness, or headaches. Severe or long-lasting anemia can damage your heart, brain, and other organs in your body.Very severe anemia may even cause death.s a result, you may feel tired or weak. You also may have other symptoms, such as shortness of breath, dizziness, or headaches. Severe or long-lasting anemia can damage your heart, brain, and other organs in your body. Very severe anemia may even cause death.",MARCO_2645006,1," 1 Anemia occurs when there are not enough red blood cells in the body. 2  Symptoms include shortness of breath, weakness, fatigue, dizziness, headache and irritability. 3  A red cell transfusion is given through your catheter over an average of two to three hours. The hemoglobin is the part of the red blood cell that carries oxygen. 2  The hemoglobin is proportional to the hematocrit. 3  Anemia occurs when there are not enough red blood cells in the body. 4  Symptoms include shortness of breath, weakness, fatigue, dizziness, headache and irritability.",MARCO_2733370,1," Signs and Symptoms of Anemia. The most common symptom of all types of anemia is fatigue (tiredness). Fatigue occurs because your body doesn't have enough red blood cells to carry oxygen to its many parts. Also, the red blood cells your body makes have less hemoglobin than normal.",MARCO_2909841,2
67_6,6," Why is blood red?<br/>What are red blood cells?<br/>How are they created?<br/>How is oxygen transported?<br/>What is anemia?<br/><span>What are the symptoms?</span>"," The symptoms of pernicious anemia can vary amongst individuals, depending on the cause, the severity of anemia, and other factors. Direct symptoms of pernicious anemia are due to a lack of red blood cells, which are vital to carrying oxygen to the cells of the body.Symptoms can include pale skin, shortness of breath, fatigue, dizziness, headache, cold hands and feet, heart palpitations, and chest pain.he symptoms of pernicious anemia can vary amongst individuals, depending on the cause, the severity of anemia, and other factors. Direct symptoms of pernicious anemia are due to a lack of red blood cells, which are vital to carrying oxygen to the cells of the body.",MARCO_3080296,3," Guide. A complete blood count (CBC) gives important information about the kinds and numbers of cells in the blood, especially red blood cells, white blood cells, and platelets. A CBC helps your doctor check any symptoms, such as weakness, fatigue, or bruising, you may have.A CBC also helps him or her diagnose conditions, such as anemia, infection, and many other disorders. A CBC test usually includes: 1  White blood cell (WBC, leukocyte) count.2  White blood cells protect the body against infection. 3  If an infection develops, white blood cells attack and destroy the bacteria, virus, or other organism causing it. 4  White blood cells are bigger than red blood cells but fewer in number.uide. A complete blood count (CBC) gives important information about the kinds and numbers of cells in the blood, especially red blood cells, white blood cells, and platelets. A CBC helps your doctor check any symptoms, such as weakness, fatigue, or bruising, you may have.",MARCO_3364137,0," This condition is called anemia and being able to identify the symptoms of anemia is highly important so that you can spot the problem when it occurs and thus help to address it. Here we will look at the symptoms of low iron, and the things you can then do to increase it again. Low iron is not the only cause of anemia. Likewise anemia can be caused by a low amount of B12 or folic acid which are also used to create red blood cells. Low Iron Symptoms (Anemia). Lethargy. Oxygen is used in the body for energy. As it is reactive it is used to help break the bonds in glucose and release the energy that we need, and likewise it is used to break down fat.",MARCO_3777436,0," Every symptom of AIDS looks like the symptoms of other illnesses. Symptoms can include severe weight loss, fevers, drenching night sweats, fatigue, severe diarrhea, and the list goes on and on. Generally the symptoms tend to last for weeks or months at a time, and do not go away by themselves (not without treatment). Symptoms do not begin until an average of 10 years after infection. You can have HIV and even full blown AIDS and have no symptoms at all! Generally speaking, if you have any symptoms that last for more than 2 weeks and do not go away, or if you have any symptoms that are very severe, always seek medical attention.",MARCO_3900551,0," Symptoms include lethargy, jaundice, fever, pale mucous membranes, and abnormal pulses. Anemia is a decrease in the mass of red blood cells, the result of lack of production, loss of red blood cells, or destruction of red blood cells. There are two types of anemia: regenerative and non-regenerative.",MARCO_4013558,3
67_6,6," Why is blood red?<br/>What are red blood cells?<br/>How are they created?<br/>How is oxygen transported?<br/>What is anemia?<br/><span>What are the symptoms?</span>"," ANEMIA PANEL. The Anemia Panel is a comprehensive panel that includes a CBC, Ferritin, Folates, Total Iron Binding Capacity with Iron, Reticulocyte Count, Vitamin B12 and Folic Acid.A CBC (Complete Blood Count) looks at important parameters of your blood including hemoglobin level, white blood cells, red blood cells and platelets.nemia is a lower than normal red blood cell count or the lack of hemoglobin in your red blood cells, resulting in a wide range of symptoms. Anemia can cause fatigue, headaches, shortness of breath, dizziness, rapid heartbeat, and a number of other symptoms.",MARCO_409998,1," The initial symptoms of malaria are flu-like and include a high temperature (fever), headache, sweats, chills and vomiting. These symptoms are often mild and can sometimes be difficult to identify as malaria.",MARCO_4342081,0," The symptoms of anemia vary according to the type of anemia, the underlying cause, the severity and any underlying health problems, such as hemorrhaging, ulcers, menstrual problems, or cancer. Specific symptoms of those problems may be noticed first.nemia Caused by Chronic Red Blood Cell Destruction. Anemia caused by chronic red blood cell destruction may include these symptoms: 1  Jaundice (yellow skin and eyes). 2  Brown or red urine. 3  Leg ulcers. 4  Failure to thrive in infancy. 5  Symptoms of gallstones.",MARCO_4409427,3," What are the symptoms of the disease? The principal symptoms of dengue fever are high fever, severe headache, severe pain behind the eyes, joint pain, muscle and bone pain, rash, and mild bleeding (e.g., nose or gums bleed, easy bruising).",MARCO_489126,0," Blood cells; red blood cells, white blood cells and platelets are made by the bone marrow. These blood cells divide quickly. Chemotherapy may lead to low blood counts, causing the possibility of a variety of symptoms. The symptoms depend on the type of low blood cell count.LOW RED BLOOD CELL COUNT (Anemia, low hemoglobin, low hematocrit). Red blood cells carry oxygen and nutrients throughout the body. A complete blood count (CBC) is a blood test used to check your blood count.The RBC, hemoglobin, and hematocrit are tests to see if you have low red blood count.he symptoms depend on the type of low blood cell count. LOW RED BLOOD CELL COUNT (Anemia, low hemoglobin, low hematocrit). Red blood cells carry oxygen and nutrients throughout the body. A complete blood count (CBC) is a blood test used to check your blood count.",MARCO_5069316,0
67_6,6," Why is blood red?<br/>What are red blood cells?<br/>How are they created?<br/>How is oxygen transported?<br/>What is anemia?<br/><span>What are the symptoms?</span>"," Anemia also can occur if your red blood cells don't contain enough hemoglobin (HEE-muh-glow-bin). Hemoglobin is an iron-rich protein that gives blood its red color. This protein helps red blood cells carry oxygen from the lungs to the rest of the body. If you have anemia, your body doesn't get enough oxygen-rich blood. As a result, you may feel tired or weak. You also may have other symptoms, such as shortness of breath, dizziness, or headaches. Severe or long-lasting anemia can damage your heart, brain, and other organs in your body. Very severe anemia may even cause death. Blood is made up of many parts, including red blood cells, white blood cells, platelets (PLATE-lets), and plasma (the fluid portion of blood).",MARCO_5292235,3," Because there are low numbers of red blood cells, not enough oxygen reaches the body's tissues. Symptoms of anemia include: 1  weakness and fatigue. 2  pale skin. 3  shortness of breath with physical activity.  lightheadedness or dizziness.",MARCO_5451454,2," People who have mild anemia, from a mild iron deficiency, for instance, may not have any symptoms at all, while people with severe anemia can have much more noticeable and longer lasting symptoms. Anemia symptoms include: 1  Fatigue. 2  This is by far the most common anemia symptom. 3  You may feel very tired or weak and unable to summon the energy for most daily activities. 4  Dizziness. 5  Dizziness is most likely to occur when you stand up from a sitting or resting position. 6  Shortness of breath.",MARCO_5733200,2," Symptoms & types. Symptoms of heart disease. Here's an easy-to-understand guide to the symptoms of each type of heart disease. Heart attack symptoms for women. Women can have a heart attack without the typical symptoms of chest pain or discomfort. Heart failure symptoms. Learn the symptoms of heart failure.",MARCO_5870272,0," There are also many other symptoms that can accompany the symptoms of anemia, depending on the disease, disorder or condition that is causing anemia. Complications of anemia can be serious, even life-threatening. Underlying diseases, disorders or conditions of anemia can also cause complications.here are also many other symptoms that can accompany the symptoms of anemia, depending on the disease, disorder or condition that is causing anemia. Complications of anemia can be serious, even life-threatening. Underlying diseases, disorders or conditions of anemia can also cause complications.",MARCO_6059759,0
67_6,6," Why is blood red?<br/>What are red blood cells?<br/>How are they created?<br/>How is oxygen transported?<br/>What is anemia?<br/><span>What are the symptoms?</span>"," This happens when the drooping of the eyelids interfere with the normal vision. 2. What Are Its Symptoms? Droopy eyelids are referred to in the medical industry as ptosis. The most common symptom of this condition would be the sagging of one or both upper eyelids. However, it also comes with other sagging eyelids symptoms such as the following: Dry or watery eyes Face that looks tired or weary Aching in the eye area Vision problems Increased tearing; 3. What Causes Sagging Eyelids? If you are experiencing the following symptoms, then it is most likely that you have ptosis and of course, you may be wondering what it happens and what causes it. Well, the main reason why eyelids droop is due to the loss of elasticity of the skin, and it can be brought about by various factors like the following: Aging",MARCO_6199633,0," Contents. 1  Bleeding symptoms AND Prostate symptoms: Causes of All Symptoms. 2  Bleeding symptoms OR Prostate symptoms: 1749 causes. 3  Bleeding symptoms: 1739 causes.  Bleeding symptoms: 1  Introduction. Prostate symptoms: Causes.  Prostate symptoms: 1  Introduction. Bleeding symptoms and Prostate symptoms and Abdominal symptoms (3 causes)",MARCO_6362539,0," Click to Check. 1  Symptoms of thalassemia major (a genetic recessive disease); also called Cooley's anemia: Hemolytic anemia. Anemia - and related symptoms of anemia. 2  more symptoms....",MARCO_6537964,0," The most common symptom of all types of anemia is fatigue (tiredness). Fatigue occurs because your body doesn't have enough red blood cells to carry oxygen to its many parts. Also, the red blood cells your body makes have less hemoglobin than normal.Hemoglobin is an iron-rich protein in red blood cells.nemia also can cause shortness of breath, dizziness, headache, coldness in your hands and feet, pale skin, chest pain, weakness, and fatigue (tiredness). If you don't have enough hemoglobin-carrying red blood cells, your heart has to work harder to move oxygen-rich blood through your body.",MARCO_6714788,2," Anemia Caused by Chronic Red Blood Cell Destruction. Anemia caused by chronic red blood cell destruction may include these symptoms: 1  Jaundice (yellow skin and eyes). 2  Brown or red urine. 3  Leg ulcers. 4  Failure to thrive in infancy. 5  Symptoms of gallstones.",MARCO_6739778,1
67_6,6," Why is blood red?<br/>What are red blood cells?<br/>How are they created?<br/>How is oxygen transported?<br/>What is anemia?<br/><span>What are the symptoms?</span>"," 1 Anemia and Leukocytosis and Red blood cell symptoms (7 causes). 2  Anemia and Leukocytosis and Enlarged liver (6 causes). 3  Anemia and Leukocytosis and Skin symptoms (6 causes). 4  Anemia and Leukocytosis and Abdominal symptoms (6 causes).",MARCO_6838116,0," Symptoms. Post-traumatic stress disorder symptoms may start within three months of a traumatic event, but sometimes symptoms may not appear until years after the event. These symptoms cause significant problems in social or work situations and in relationships.ymptoms. Post-traumatic stress disorder symptoms may start within three months of a traumatic event, but sometimes symptoms may not appear until years after the event. These symptoms cause significant problems in social or work situations and in relationships.",MARCO_6893095,0," What are the symptoms of aplastic anemia in a child? These are the most common symptoms of aplastic anemia. Symptoms may include: From decreased red blood cells: Headache; Dizziness; Shortness of breath; Lack of energy or tiring easily (fatigue) Pale skin; Chest pain; Irregular heart beat; Enlarged heart",MARCO_699407,2," Review the available symptom checkers for these symptoms of Colorectal Polyps: 1  Gastrointestinal bleeding -- Symptom Checker. 2  Rectal bleeding -- Symptom Checker. 3  Diarrhea -- Symptom Checker.  Constipation -- Symptom 1  Checker. Blood in stool -- Symptom Checker.  Fatigue -- Symptom 1  Checker. Weakness -- Symptom Checker.  Weight loss -- Symptom Checker.",MARCO_7034475,0," The signs and symptoms of iron-deficiency anemia depend on its severity. Mild to moderate iron-deficiency anemia may have no signs or symptoms. When signs and symptoms do occur, they can range from mild to severe. Many of the signs and symptoms of iron-deficiency anemia apply to all types of anemia. Signs and Symptoms of Anemia",MARCO_7137447,0
