queryNum,subQueryNum,query,text1,document1,score1,text2,document2,score2,text3,document3,score3,text4,document4,score4,text5,document5,score5
67_11,11," Why is blood red?<br/>What are red blood cells?<br/>How are they created?<br/>How is oxygen transported?<br/>What is anemia?<br/>What are the symptoms?<br/>Can it go away?<br/>What are its possible causes?<br/>How is it treated?<br/>What foods contain high levels of iron?<br/><span>What improves absorption?</span>"," Common Types of Anemia. Iron-deficiency anemia is the most common type of anemia. It happens when you do not have enough iron in your body. Iron deficiency is usually due to blood loss but may occasionally be due to poor absorption of iron.Pregnancy and childbirth consume a great deal of iron and thus can result in pregnancy-related anemia.he Role of Red Blood Cells in Anemia. Red blood cells carry hemoglobin, an iron-rich protein that attaches to oxygen in the lungs and carries it to tissues throughout the body.",MARCO_1094624,0," Disorders that increase the absorption of certain nutrients include hemochromatosis (increased iron absorption; also called iron overload disease) and Wilson's disease (increased copper absorption).",MARCO_1194257,0," A National Academy of Sports Medicine answered. Vitamin C enhances the absorption of iron. A typical example of foods that provide optimal iron is chili with lean ground beef. The ground beef contains heme iron, and the tomato sauce contains vitamin C which enhances the non-heme iron in the other ingredients.",MARCO_13352,4," Foods to Increase Red Blood Cells. Eating the right foods can help increase the number of red blood cells in your body. Here are a few of the ways you can eat your way to better blood cell health: Iron. Food rich in iron can help your body rebuild what it has lost.",MARCO_1482844,0," Iron deficiency anemia is a worldwide health problem that is especially common in young women and in children. Iron is found in food in two forms, heme and non-heme iron. Heme iron, which makes up 40 percent of the iron in meat, poultry, and fish, is well absorbed.Non-heme iron, 60 percent of the iron in animal tissue and all the iron in plants (fruits, vegetables, grains, nuts) is less well absorbed.Because vegan diets only contain non-heme iron, vegans should be especially aware of foods that are high in iron and techniques that can promote iron absorption.on-heme iron, 60 percent of the iron in animal tissue and all the iron in plants (fruits, vegetables, grains, nuts) is less well absorbed. Because vegan diets only contain non-heme iron, vegans should be especially aware of foods that are high in iron and techniques that can promote iron absorption.",MARCO_1563827,0
67_11,11," Why is blood red?<br/>What are red blood cells?<br/>How are they created?<br/>How is oxygen transported?<br/>What is anemia?<br/>What are the symptoms?<br/>Can it go away?<br/>What are its possible causes?<br/>How is it treated?<br/>What foods contain high levels of iron?<br/><span>What improves absorption?</span>"," Low iron levels can lead to iron deficiency anemia, a condition of inadequate amounts of healthy red blood cells. You can choose iron supplements to improve your levels, but they often cause nausea and constipation. Following a healthy diet including iron-rich foods, and pairing foods for optimal absorption, can help you increase your iron levels naturally.",MARCO_1776861,0," Anemia (uh-NEE-me-uh) is a condition in which your blood has a lower than normal number of red blood cells. Anemia also can occur if your red blood cells don't contain enough hemoglobin (HEE-muh-glow-bin).Hemoglobin is an iron-rich protein that gives blood its red color.This protein helps red blood cells carry oxygen from the lungs to the rest of the body. If you have anemia, your body doesn't get enough oxygen-rich blood.nemia also can occur if your red blood cells don't contain enough hemoglobin (HEE-muh-glow-bin). Hemoglobin is an iron-rich protein that gives blood its red color. This protein helps red blood cells carry oxygen from the lungs to the rest of the body. If you have anemia, your body doesn't get enough oxygen-rich blood.",MARCO_1796358,0," It improves the digestion and absorption and is recommended in the treatment of psoriasis, syphilis and impure blood conditions. A decoction of the peeled and chopped root bark has been used as a wash in treating arthritis and as an eyewash for red itchy eyes.",MARCO_2018016,0," Bone and Dental Health. Coconut oil improves calcium and magnesium absorption in the body, which in turn is greatly beneficial to dental and bone health. The improved calcium absorption created by coconut oil use ceases tooth decay and aids in the development of strong teeth.",MARCO_2117224,0," Foods That Affect Iron Absorption. Certain Foods Can Increase or Decrease Absorption of Non-Heme Iron. The absorption of heme iron (from meat and animal products) isn't generally affected by diet; however, your body's absorption of non-heme iron (from plant sources) can vary depending on other items you eat or drink.1.",MARCO_2135143,0
67_11,11," Why is blood red?<br/>What are red blood cells?<br/>How are they created?<br/>How is oxygen transported?<br/>What is anemia?<br/>What are the symptoms?<br/>Can it go away?<br/>What are its possible causes?<br/>How is it treated?<br/>What foods contain high levels of iron?<br/><span>What improves absorption?</span>"," Drinking tea immediately after a meal can inhibit iron absorption from vegetable sources, however it does not inhibit iron absorption from cooked meat. Source-The effect of tea on iron absorption. The effect of tea on iron absorption was studied in human volunteers.",MARCO_2229097,0," Foods that Improve Anemia - Slideshow. Anemia is a blood disorder caused by reduced hemoglobin level in the blood. It occurs mainly due to excessive blood loss, reduced production of red blood cell, iron-deficient diet, abnormalities in the upper gastrointestinal tract where most of the dietary iron is absorbed.",MARCO_2342084,0," The downfall with iron in cereal is that its nonheme, a type of iron that is difficult for your body to absorb. Just pile a little fruit onto your cereal; the vitamin C improves nonheme iron absorption.Very few foods are natural sources of vitamin D, but you can get it through fortified foods, including cereals.he downfall with iron in cereal is that its nonheme, a type of iron that is difficult for your body to absorb. Just pile a little fruit onto your cereal; the vitamin C improves nonheme iron absorption.",MARCO_2632620,4," 1. Start Consuming Bone Broth. Bone broth is an incredibly nutrient dense food and it is also very inexpensive to make. Broth is packed with minerals, gut-soothing gelatin and amino acids proline and glycine. Broths natural gelatin content helps sooth the digestive track and improve nutrient absorption.",MARCO_3020221,0," It provides health benefits including: 1  Aids digestion. 2  Enhances absorption of calcium and magnesium. 3  Improves elimination of toxins. 4  May reduce the risk of colon cancer.",MARCO_3164726,0
67_11,11," Why is blood red?<br/>What are red blood cells?<br/>How are they created?<br/>How is oxygen transported?<br/>What is anemia?<br/>What are the symptoms?<br/>Can it go away?<br/>What are its possible causes?<br/>How is it treated?<br/>What foods contain high levels of iron?<br/><span>What improves absorption?</span>"," Build a strong structure. When it comes to building strong bones, there are two key nutrients: calcium and vitamin D. Calcium supports your bones and teeth structure, while vitamin D improves calcium absorption and bone growth.These nutrients are important early in life, but they may also help as you age.uild a strong structure. When it comes to building strong bones, there are two key nutrients: calcium and vitamin D. Calcium supports your bones and teeth structure, while vitamin D improves calcium absorption and bone growth.",MARCO_3328826,0," Iron is vital for your body throughout life. It is a part of the red blood cells, and it carries oxygen to all parts of the body. Iron from some food sources, such as meat, is readily absorbed into the body. When iron supplements are used, the iron is not readily absorbed and can result in constipation. Increasing the amount of vitamin C in your diet can enhance the absorption of iron in your body.",MARCO_3512429,4," Those who took supplemental iron along with fruit had higher iron stores, some as much as three times. No one is encouraged to consume sugar to improve iron absorption. Too much sugar can lead to other health problems, such as obesity and diabetes. Refined white sugar has no nutritional value except calories.",MARCO_3831791,4," This is why the most common way to improve protein powder absorption is to take a proteolytic enzyme supplement with your protein shake. Bromelain is a supplement used for this purpose. It is a mixture of proteolytic enzymes found in pineapple that can help digest and absorb protein.",MARCO_4220992,0," The use of EPO is believed to increase oxygen absorption, reduce fatigue and improve endurance by increasing the rate of red cell production. It is also believed that EPO increases the metabolism and the healing process of muscles because the extra red cells carry more oxygen and nutrients.",MARCO_4360689,0
67_11,11," Why is blood red?<br/>What are red blood cells?<br/>How are they created?<br/>How is oxygen transported?<br/>What is anemia?<br/>What are the symptoms?<br/>Can it go away?<br/>What are its possible causes?<br/>How is it treated?<br/>What foods contain high levels of iron?<br/><span>What improves absorption?</span>"," Fortunately, many vegetables, such as broccoli and bok choy, which are high in iron, are also high in vitamin C so that the iron in these foods is very well absorbed. Commonly eaten combinations, such as beans and tomato sauce or stir-fried tofu and broccoli, also result in generous levels of iron absorption.on-heme iron, 60 percent of the iron in animal tissue and all the iron in plants (fruits, vegetables, grains, nuts) is less well absorbed. Because vegan diets only contain non-heme iron, vegans should be especially aware of foods that are high in iron and techniques that can promote iron absorption.",MARCO_4618798,4," Avoid Foods that Decrease Absorption. Calcium, tannins, phosphates and fiber interfere with the intake of heme and non-heme iron, according to Colorado State University Extension. Avoid eating or drinking dairy products, cola drinks, tea, coffee and high-fiber foods with iron foods to improve absorption.",MARCO_4947038,0," Anemia also can occur if your red blood cells don't contain enough hemoglobin (HEE-muh-glow-bin). Hemoglobin is an iron-rich protein that gives blood its red color. This protein helps red blood cells carry oxygen from the lungs to the rest of the body. If you have anemia, your body doesn't get enough oxygen-rich blood. As a result, you may feel tired or weak. You also may have other symptoms, such as shortness of breath, dizziness, or headaches. Severe or long-lasting anemia can damage your heart, brain, and other organs in your body. Very severe anemia may even cause death. Blood is made up of many parts, including red blood cells, white blood cells, platelets (PLATE-lets), and plasma (the fluid portion of blood).",MARCO_5292235,0," When it comes to building strong bones, there are two key nutrients: calcium and vitamin D. Calcium supports your bones and teeth structure, while vitamin D improves calcium absorption and bone growth.",MARCO_530691,0," Improving absorption begins with consuming adequate amounts of B12-rich foods including meat, poultry, fish, eggs, dairy and fortified products. Vitamin B12 is typically found in animal products, so consider taking B12 supplements if you are a vegan.",MARCO_5966214,0
67_11,11," Why is blood red?<br/>What are red blood cells?<br/>How are they created?<br/>How is oxygen transported?<br/>What is anemia?<br/>What are the symptoms?<br/>Can it go away?<br/>What are its possible causes?<br/>How is it treated?<br/>What foods contain high levels of iron?<br/><span>What improves absorption?</span>"," Anemia (uh-NEE-me-uh) is a condition in which your blood has a lower than normal number of red blood cells. Anemia also can occur if your red blood cells don't contain enough hemoglobin (HEE-muh-glow-bin). Hemoglobin is an iron-rich protein that gives blood its red color.This protein helps red blood cells carry oxygen from the lungs to the rest of the body. If you have anemia, your body doesn't get enough oxygen-rich blood.As a result, you may feel tired or weak. You also may have other symptoms, such as shortness of breath, dizziness, or headaches. Severe or long-lasting anemia can damage your heart, brain, and other organs in your body.nemia has three main causes: blood loss, lack of red blood cell production, or high rates of red blood cell destruction. These causes might be the result of diseases, conditions, or other factors. Many types of anemia can be mild, short term, and easily treated.",MARCO_6200559,0," Although iron is widely distributed in foods, some sources are better absorbed than others. The best sources of iron are foods with a high iron content and are easily absorbed by the body. Iron absorption is best (15-18%) from foods that contain haem iron. Red meat, seafood and poultry are the best sources of haem iron.Some substances in food inhibit the absorption of iron. Excessive intakes of tea, coffee and bran have an inhibitory effect.he best sources of iron are foods with a high iron content and are easily absorbed by the body. Iron absorption is best (15-18%) from foods that contain haem iron. Red meat, seafood and poultry are the best sources of haem iron. Some substances in food inhibit the absorption of iron.",MARCO_6366653,0," Eating foods rich in these five nutrients can help you improve your red blood cell levels. Iron Eating an iron-rich diet can increase your bodys production of RBCs.",MARCO_672237,0," Treating underlying causes of iron deficiency. If iron supplements don't increase your blood-iron levels, it's likely the anemia is due to a source of bleeding or an iron-absorption problem that your doctor will need to investigate and treat. Depending on the cause, iron deficiency anemia treatment may involve:reating underlying causes of iron deficiency. If iron supplements don't increase your blood-iron levels, it's likely the anemia is due to a source of bleeding or an iron-absorption problem that your doctor will need to investigate and treat. Depending on the cause, iron deficiency anemia treatment may involve:",MARCO_7074208,0," If you mix some lean meat, fish, or poultry with beans or dark leafy greens at a meal, you can improve absorption of vegetable sources of iron up to three times. Foods rich in vitamin C ( such as citrus, strawberries, tomatoes, and potatoes) also increase iron absorption. Cooking foods in a cast-iron skillet can also help to increase the amount of iron provided. Some foods reduce iron absorption.",MARCO_7350953,4
67_11,11," Why is blood red?<br/>What are red blood cells?<br/>How are they created?<br/>How is oxygen transported?<br/>What is anemia?<br/>What are the symptoms?<br/>Can it go away?<br/>What are its possible causes?<br/>How is it treated?<br/>What foods contain high levels of iron?<br/><span>What improves absorption?</span>"," Enhancers of dietary non-haem iron absorption. Vitamin C found in fruit, fruit juice and vegetables, enhances iron absorption by reducing the ferric iron to the more readily absorbed ferrous form. In addition, it also protects any iron in the ferrous form from being oxidised back to the ferric form.",MARCO_7608189,4," Vitamin C. Vitamin C captures non-heme iron and keeps it in a form that makes it more available for absorption. Foods high in vitamin C such as citrus fruits, dark green leafy vegetables, melons, potatoes, tomatoes and strawberries improve the absorption of non-heme iron.itamin C. Vitamin C captures non-heme iron and keeps it in a form that makes it more available for absorption. Foods high in vitamin C such as citrus fruits, dark green leafy vegetables, melons, potatoes, tomatoes and strawberries improve the absorption of non-heme iron.",MARCO_7704248,4," Variations. 1  Divine Power Absorption. 2  Empathic Power Absorption. 3  Enhanced Power Absorption. 4  Post-Mortem Power Absorption. 5  Power Borrowing Enhanced Power Borrowing. 6  Power Containment. 7  Regenerative Absorption. 8  Strength Absorption.",MARCO_8105321,0," self-absorption noun, at self-absorbed; overhead absorption rate, at absorption rate; absorption costing; real-estate absorption rate, at absorption rate; overhead absorption rate; absorption rate; carbon absorption",MARCO_8471442,0," Choose foods containing vitamin C to enhance iron absorption. You can enhance your body's absorption of iron by drinking citrus juice or eating other foods rich in vitamin C at the same time that you eat high-iron foods. Vitamin C in citrus juices, like orange juice, helps your body to better absorb dietary iron.Vitamin C is also found in: 1  Broccoli. 2  Grapefruit. 3  Kiwi.oods rich in iron include: 1  Red meat. 2  Pork. 3  Poultry. 4  Seafood. 5  Beans. 6  Dark green leafy vegetables, such as spinach. 7  Dried fruit, such as raisins and apricots.",MARCO_885881,4
67_11,11," Why is blood red?<br/>What are red blood cells?<br/>How are they created?<br/>How is oxygen transported?<br/>What is anemia?<br/>What are the symptoms?<br/>Can it go away?<br/>What are its possible causes?<br/>How is it treated?<br/>What foods contain high levels of iron?<br/><span>What improves absorption?</span>"," Common Types of Anemia. Iron-deficiency anemia is the most common type of anemia. It happens when you do not have enough iron in your body. Iron deficiency is usually due to blood loss but may occasionally be due to poor absorption of iron.Pregnancy and childbirth consume a great deal of iron and thus can result in pregnancy-related anemia.he Role of Red Blood Cells in Anemia. Red blood cells carry hemoglobin, an iron-rich protein that attaches to oxygen in the lungs and carries it to tissues throughout the body.",MARCO_1094624,0," A National Academy of Sports Medicine answered. Vitamin C enhances the absorption of iron. A typical example of foods that provide optimal iron is chili with lean ground beef. The ground beef contains heme iron, and the tomato sauce contains vitamin C which enhances the non-heme iron in the other ingredients.",MARCO_13352,4," Disorders that increase the absorption of certain nutrients include hemochromatosis (increased iron absorption; also called iron overload disease) and Wilson's disease (increased copper absorption).",MARCO_1194257,0," The downfall with iron in cereal is that its nonheme, a type of iron that is difficult for your body to absorb. Just pile a little fruit onto your cereal; the vitamin C improves nonheme iron absorption.Very few foods are natural sources of vitamin D, but you can get it through fortified foods, including cereals.he downfall with iron in cereal is that its nonheme, a type of iron that is difficult for your body to absorb. Just pile a little fruit onto your cereal; the vitamin C improves nonheme iron absorption.",MARCO_2632620,4," Foods to Increase Red Blood Cells. Eating the right foods can help increase the number of red blood cells in your body. Here are a few of the ways you can eat your way to better blood cell health: Iron. Food rich in iron can help your body rebuild what it has lost.",MARCO_1482844,0
68_1,1," <span>What is cuisine is Emilia-Romagna famous for?</span>"," Answer by GeordieSteve. Confidence votes 7.5K. Bologna is the capital city of Emilia-Romagna, in the Po Valley of northern Italy Home to the oldest university in the Western world, University of Bologna, founded in 1088, Bologna is one of the most developed cities in Italy.ologna often ranks as one of the top cities, in terms of quality of life in Italy Bologna is a very important railway and motorway hub in Italy. Bologna is renowned for its culinary tradition. It has given its name to the well-known Bolognese sauce, a meat based pasta sauce.",MARCO_212612,1," The city is known for its beauty, great cuisine, and left-wing politics-home to the former Italian communist party and its newspaper, L'Unita. Bologna Location: Bologna is the capital of the Emilia-Romagna region in northern Italy.It's less than an hour inland from the east coast and about halfway between Florence and Milan. See Emilia-Romagna Map. Bologna can be visited any time of the year although it may be pretty cold in winter and hot in summer.ologna is the capital of the Emilia-Romagna region in northern Italy. It's less than an hour inland from the east coast and about halfway between Florence and Milan. See Emilia-Romagna Map. Bologna can be visited any time of the year although it may be pretty cold in winter and hot in summer.",MARCO_212617,0," Bologna is the capital of the Emilia-Romagna region in northern Italy. It's less than an hour inland from the east coast and about halfway between Florence and Milan. See Emilia-Romagna Map.",MARCO_3059092,0," Ragu vs Bolognese. Italian cuisine is famous for its simplicity and variety with cheese and wine as major components of every Italian food recipe. It is also known for its pasta of different shapes, lengths, and widths and sauces with different ingredients.",MARCO_436543,1," Fondue and Cheese. Cheese and fondue go hand in hand, but Swiss cuisine has several fondue variations. Swiss cheese, made up of raw milk, is perhaps the most famous cheese to come out of the country. Other famous cheeses are still produced by hand and include Gruyere, Gruyre, Emmentaler tete Tte, De moine Sbrinz. and vacherinondue and Cheese. Cheese and fondue go hand in hand, but Swiss cuisine has several fondue variations. Swiss cheese, made up of raw milk, is perhaps the most famous cheese to come out of the country. Other famous cheeses are still produced by hand and include Gruyere, Gruyre, Emmentaler tete Tte, De moine Sbrinz. and vacherin",MARCO_5167518,0
68_1,1," <span>What is cuisine is Emilia-Romagna famous for?</span>"," Examples of cuisine in a sentence. 1  a cooking method used in French cuisine. 2  a cuisine based on local ingredients. 3  This restaurant is famous for its spicy cuisine.",MARCO_5866996,0," Zuppa Inglese. One of the most famous Bologna desserts, its a very old dish also served also in other Emilia Romagna towns and similar to Tiramis. It is made with liquor (Rosolio or Marsala) soaked sponge cake, custard and cocoa powder. It takes its name from an ancient Elizabethan recipe.",MARCO_6897477,2," A popular Christmas food in Emilia-Romagna and the north: filled pasta. After youve (ahem) refrained from indulging on Christmas Eve, youre allowed to really tuck in on Christmas Day. Lunch is the main meal. Pasta in brodo pasta in brothis a common kickoff to the meal across Italy, but particularly in the north. In Bologna, its all about meat-filled tortellini in capon (eel) broth; in Ferrara, the pastas stuffed with pumpkin filling.",MARCO_6938011,3," Italy . The typical pasta recipe of Bologna (in Emilia Romagna). This meat-based pasta recipe is prepared with tomatoes, fried garlic, olives all prepared with ground meat, usually a mix of beef (or veal) and pork. When served top it with Parmigiano cheese and peperoncino. See also: Matching each sauce with the right type of pasta Types of pasta Italian cuisine",MARCO_8028416,3," Min Cuisine is one of the eight famous cuisines in China. Min Cuisine, also called Fujian Cuisine, originates from South China's Fujian Province. The history of Min Cuisine dates back to 5000 years ago.",MARCO_8668381,0
